{
  "schema_version": "g07-text-convergence-dataset-v1",
  "dataset_version": "g07-text-convergence-v1",
  "public_non_blind": true,
  "cases": [
    {
      "case_id": "BT-COMPAT-001",
      "group": "STRUCTURE_ROLE_DATE",
      "input_text": "北京五日游。第1天 故宫博物院→景山公园\n第 2 天 天坛公园\n第三天 颐和园\nDay 4 南锣鼓巷\nD5 前门大街",
      "lane": "TEXT_MULTI_GUARD",
      "safe_expectation": {"summary": "日期标签与原顺序不制造地点", "forbidden_cards": [], "forbidden_eligible_mentions": [], "forbidden_auto_matches": [], "required_facts": ["NO_DANGEROUS_OUTPUT"], "allowed_degradations": ["SAFE_OMISSION"]},
      "exact_expectation": {"summary": "五种日期标签归日且保持日内顺序", "destination_name": "北京", "ordered_cards": [{"day_index": 1, "cards": [{"name": "故宫博物院"}, {"name": "景山公园"}]}, {"day_index": 2, "cards": [{"name": "天坛公园"}]}, {"day_index": 3, "cards": [{"name": "颐和园"}]}, {"day_index": 4, "cards": [{"name": "南锣鼓巷"}]}, {"day_index": 5, "cards": [{"name": "前门大街"}]}], "mentions": [], "required_facts": []},
      "severity": "P1",
      "probe": {"kind": "PIPELINE", "variant": "DAY_LABELS"}
    },
    {
      "case_id": "BT-COMPAT-002",
      "group": "STRUCTURE_ROLE_DATE",
      "input_text": "北京两日游。Day 2 天坛公园→颐和园\nDay 1 故宫博物院→景山公园",
      "lane": "TEXT_MULTI_GUARD",
      "safe_expectation": {"summary": "倒序标签不串日", "forbidden_cards": [], "forbidden_eligible_mentions": [], "forbidden_auto_matches": [], "required_facts": ["NO_DANGEROUS_OUTPUT"], "allowed_degradations": ["SAFE_OMISSION"]},
      "exact_expectation": {"summary": "输出按日升序", "destination_name": "北京", "ordered_cards": [{"day_index": 1, "cards": [{"name": "故宫博物院"}, {"name": "景山公园"}]}, {"day_index": 2, "cards": [{"name": "天坛公园"}, {"name": "颐和园"}]}], "mentions": [], "required_facts": []},
      "severity": "P1",
      "probe": {"kind": "PIPELINE", "variant": "OUT_OF_ORDER_DAYS"}
    },
    {
      "case_id": "BT-COMPAT-003",
      "group": "STRUCTURE_ROLE_DATE",
      "input_text": "北京一日游。Day 1｜甲景点→乙景点⇒丙景点->丁景点➜戊景点⇨己景点＞庚景点➔辛景点➡壬景点⟶癸景点",
      "lane": "TEXT_MULTI_GUARD",
      "safe_expectation": {"summary": "箭头只分隔原子地点", "forbidden_cards": ["Day 1｜甲景点"], "forbidden_eligible_mentions": ["Day 1｜甲景点"], "forbidden_auto_matches": [], "required_facts": ["NO_DANGEROUS_OUTPUT"], "allowed_degradations": ["SAFE_OMISSION"]},
      "exact_expectation": {"summary": "九种箭头得到十个有序地点", "ordered_cards": [{"day_index": 1, "cards": [{"name": "甲景点"}, {"name": "乙景点"}, {"name": "丙景点"}, {"name": "丁景点"}, {"name": "戊景点"}, {"name": "己景点"}, {"name": "庚景点"}, {"name": "辛景点"}, {"name": "壬景点"}, {"name": "癸景点"}]}], "mentions": [], "required_facts": []},
      "severity": "P1",
      "probe": {"kind": "PIPELINE", "variant": "ARROW_SEPARATORS"}
    },
    {
      "case_id": "BT-COMPAT-004",
      "group": "STRUCTURE_ROLE_DATE",
      "input_text": "北京；D1｜甲景点→乙景点／丙景点；D2｜丁景点、戊景点",
      "lane": "TEXT_MULTI_GUARD",
      "safe_expectation": {"summary": "紧凑全角格式不制造复合地点", "forbidden_cards": ["D1｜甲景点", "乙景点／丙景点", "D2｜丁景点"], "forbidden_eligible_mentions": ["D1｜甲景点", "乙景点／丙景点", "D2｜丁景点"], "forbidden_auto_matches": [], "required_facts": ["NO_DANGEROUS_OUTPUT"], "allowed_degradations": ["SAFE_OMISSION"]},
      "exact_expectation": {"summary": "D1与D2节点完整归日", "ordered_cards": [{"day_index": 1, "cards": [{"name": "甲景点"}, {"name": "乙景点"}, {"name": "丙景点"}]}, {"day_index": 2, "cards": [{"name": "丁景点"}, {"name": "戊景点"}]}], "mentions": [], "required_facts": []},
      "severity": "P1",
      "probe": {"kind": "PIPELINE", "variant": "COMPACT_FULLWIDTH"}
    },
    {
      "case_id": "BT-COMPAT-005",
      "group": "STRUCTURE_ROLE_DATE",
      "input_text": "北京两日游。Day 1 去故宫博物院。Day 2 如果还有时间去颐和园；网友提到天坛公园；取消南锣鼓巷；路过前门大街，但不在那里游览。",
      "lane": "TEXT_MULTI_GUARD",
      "safe_expectation": {"summary": "只有原子PLANNED进入卡片", "forbidden_cards": ["颐和园", "天坛公园", "南锣鼓巷", "前门大街"], "forbidden_eligible_mentions": ["颐和园", "天坛公园", "南锣鼓巷", "前门大街"], "forbidden_auto_matches": [], "required_facts": ["NO_DANGEROUS_OUTPUT"], "allowed_degradations": ["SAFE_OMISSION"]},
      "exact_expectation": {"summary": "五类角色正确", "ordered_cards": [{"day_index": 1, "cards": [{"name": "故宫博物院"}]}, {"day_index": 2, "cards": []}], "mentions": [{"name": "故宫博物院", "role": "PLANNED", "eligible": true}, {"name": "颐和园", "role": "OPTIONAL", "eligible": false}, {"name": "天坛公园", "role": "REFERENCE", "eligible": false}, {"name": "南锣鼓巷", "role": "EXCLUDED", "eligible": false}, {"name": "前门大街", "role": "PASS_THROUGH", "eligible": false}], "required_facts": []},
      "severity": "P0",
      "probe": {"kind": "PIPELINE", "variant": "ACTIVITY_ROLES"}
    },
    {
      "case_id": "BT-COMPAT-006",
      "group": "STRUCTURE_ROLE_DATE",
      "input_text": "北京一日游。Day 1 如果还有时间去颐和园。",
      "lane": "TEXT_MULTI_GUARD",
      "safe_expectation": {"summary": "条件地点不自动建卡", "forbidden_cards": ["颐和园"], "forbidden_eligible_mentions": ["颐和园"], "forbidden_auto_matches": ["颐和园"], "required_facts": ["NO_DANGEROUS_OUTPUT"], "allowed_degradations": ["SAFE_OMISSION"]},
      "exact_expectation": {"summary": "颐和园保留为OPTIONAL", "ordered_cards": [{"day_index": 1, "cards": []}], "mentions": [{"name": "颐和园", "role": "OPTIONAL", "eligible": false}], "required_facts": []},
      "severity": "P0",
      "probe": {"kind": "PIPELINE", "variant": "CONDITIONAL_OPTIONAL"}
    },
    {
      "case_id": "BT-COMPAT-007",
      "group": "STRUCTURE_ROLE_DATE",
      "input_text": "北京一日游。Day 1 去故宫博物院或者颐和园，二选一。",
      "lane": "TEXT_MULTI_GUARD",
      "safe_expectation": {"summary": "二选一不生成确定卡", "forbidden_cards": ["故宫博物院", "颐和园"], "forbidden_eligible_mentions": ["故宫博物院", "颐和园"], "forbidden_auto_matches": ["故宫博物院", "颐和园"], "required_facts": ["NO_DANGEROUS_OUTPUT"], "allowed_degradations": ["SAFE_OMISSION"]},
      "exact_expectation": {"summary": "两个候选均为OPTIONAL", "ordered_cards": [{"day_index": 1, "cards": []}], "mentions": [{"name": "故宫博物院", "role": "OPTIONAL", "eligible": false}, {"name": "颐和园", "role": "OPTIONAL", "eligible": false}], "required_facts": []},
      "severity": "P0",
      "probe": {"kind": "PIPELINE", "variant": "NON_ATOMIC_CHOICE"}
    },
    {
      "case_id": "BT-COMPAT-008",
      "group": "STRUCTURE_ROLE_DATE",
      "input_text": "北京攻略说明：预约网址 https://example.invalid/place/故宫博物院，电话010-12345678；请不要把说明句生成地点卡。",
      "lane": "TEXT_MULTI_GUARD",
      "safe_expectation": {"summary": "URL电话元指令不成地点", "forbidden_cards": ["故宫博物院", "预约网址", "说明句"], "forbidden_eligible_mentions": ["故宫博物院", "预约网址", "说明句"], "forbidden_auto_matches": ["故宫博物院"], "required_facts": ["NO_DANGEROUS_OUTPUT"], "allowed_degradations": []},
      "exact_expectation": {"summary": "无公开卡片", "ordered_cards": [{"day_index": 1, "cards": []}], "mentions": [], "eligible_count": 0, "required_facts": []},
      "severity": "P0",
      "probe": {"kind": "PIPELINE", "variant": "META_URL_PHONE"}
    },
    {
      "case_id": "BT-COMPAT-009",
      "group": "STRUCTURE_ROLE_DATE",
      "input_text": "北京一日游。Day 1 故宫博物院介绍：旧称紫禁城，曾称宫城；这只是历史说明。",
      "lane": "TEXT_MULTI_GUARD",
      "safe_expectation": {"summary": "介绍与旧名不成卡", "forbidden_cards": ["故宫博物院", "故宫博物院介绍", "紫禁城", "宫城"], "forbidden_eligible_mentions": ["故宫博物院", "故宫博物院介绍", "紫禁城", "宫城"], "forbidden_auto_matches": [], "required_facts": ["NO_DANGEROUS_OUTPUT"], "allowed_degradations": ["REFERENCE_MENTION_OMITTED"]},
      "exact_expectation": {"summary": "故宫只可作为REFERENCE", "ordered_cards": [{"day_index": 1, "cards": []}], "mentions": [{"name": "故宫博物院", "role": "REFERENCE", "eligible": false}], "required_facts": []},
      "severity": "P0",
      "probe": {"kind": "PIPELINE", "variant": "OLD_NAME_DESCRIPTION"}
    },
    {
      "case_id": "BT-COMPAT-010",
      "group": "STRUCTURE_ROLE_DATE",
      "input_text": "北京一日游。Day 1 故宫博物院讲解→景山公园拍照→公厕→停车场→充电站。",
      "lane": "TEXT_MULTI_GUARD",
      "safe_expectation": {"summary": "动作后缀与裸设施不成地点", "forbidden_cards": ["故宫博物院讲解", "景山公园拍照", "公厕", "停车场", "充电站"], "forbidden_eligible_mentions": ["故宫博物院讲解", "景山公园拍照", "公厕", "停车场", "充电站"], "forbidden_auto_matches": [], "required_facts": ["NO_DANGEROUS_OUTPUT"], "allowed_degradations": ["SAFE_OMISSION"]},
      "exact_expectation": {"summary": "仅保留两处真实地点", "ordered_cards": [{"day_index": 1, "cards": [{"name": "故宫博物院"}, {"name": "景山公园"}]}], "mentions": [], "required_facts": []},
      "severity": "P0",
      "probe": {"kind": "PIPELINE", "variant": "ACTION_SUFFIX_AND_FACILITY"}
    },
    {
      "case_id": "BT-COMPAT-011",
      "group": "TIME_CANCEL_RESCHEDULE",
      "input_text": "北京一日游。Day 1 上午去故宫博物院。",
      "lane": "TEXT_MULTI_GUARD",
      "safe_expectation": {"summary": "时段不进入地点名", "forbidden_cards": ["上午去故宫博物院"], "forbidden_eligible_mentions": ["上午去故宫博物院"], "forbidden_auto_matches": [], "required_facts": ["NO_DANGEROUS_OUTPUT"], "allowed_degradations": ["TIME_HINT_OMITTED"]},
      "exact_expectation": {"summary": "上午写入time_hint", "ordered_cards": [{"day_index": 1, "cards": [{"name": "故宫博物院", "time_hint": "上午"}]}], "mentions": [], "required_facts": []},
      "severity": "P1",
      "probe": {"kind": "PIPELINE", "variant": "PERIOD_HINT"}
    },
    {
      "case_id": "BT-COMPAT-012",
      "group": "TIME_CANCEL_RESCHEDULE",
      "input_text": "北京一日游。Day 1 14:00去故宫博物院。",
      "lane": "TEXT_MULTI_GUARD",
      "safe_expectation": {"summary": "数字时刻不进入地点名", "forbidden_cards": ["14", "14:00去故宫博物院"], "forbidden_eligible_mentions": ["14", "14:00去故宫博物院"], "forbidden_auto_matches": [], "required_facts": ["NO_DANGEROUS_OUTPUT"], "allowed_degradations": ["TIME_HINT_OMITTED"]},
      "exact_expectation": {"summary": "14:00写入time_hint", "ordered_cards": [{"day_index": 1, "cards": [{"name": "故宫博物院", "time_hint": "14:00"}]}], "mentions": [], "required_facts": []},
      "severity": "P1",
      "probe": {"kind": "PIPELINE", "variant": "CLOCK_HINT"}
    },
    {
      "case_id": "BT-COMPAT-013",
      "group": "TIME_CANCEL_RESCHEDULE",
      "input_text": "北京一日游。Day 1 下午2点去故宫博物院。",
      "lane": "TEXT_MULTI_GUARD",